{
 "chapter": "ch73",
 "menus": {
  "ch73_s010_m001": {
   "items": [
    "Свернуть в переулок",
    "Пройти мимо"
   ]
  },
  "ch73_s030_m001": {
   "items": [
    "Уйти домой",
    "Вернуться к находке"
   ]
  }
 },
 "retired": {},
 "says": {
  "ch73_s010_0001": {
   "text": "T4: свернуть в переулок или пройти мимо.",
   "who": null
  },
  "ch73_s020_0001": {
   "text": "T4: пропускаемая сцена — о ней можно не узнать.",
   "who": null
  },
  "ch73_s030_0001": {
   "text": "T4: развилка концовок.",
   "who": null
  },
  "ch73_s040_0001": {
   "text": "T4: обычная концовка.",
   "who": null
  },
  "ch73_s050_0001": {
   "text": "T4: секретная концовка — только если найдена s020.",
   "who": null
  }
 },
 "schema": "ledger@2"
}
