{
 "chapter": "ch71",
 "menus": {
  "ch71_s010_m001": {
   "items": [
    "Довериться",
    "Сомневаться"
   ]
  },
  "ch71_s020_m001": {
   "items": [
    "Рискнуть",
    "Не рисковать"
   ]
  },
  "ch71_s030_m001": {
   "items": [
    "Рискнуть",
    "Не рисковать"
   ]
  }
 },
 "retired": {},
 "says": {
  "ch71_s010_0001": {
   "text": "T2: первая развилка — доверие.",
   "who": null
  },
  "ch71_s020_0001": {
   "text": "T2: вторая развилка на ветке доверия.",
   "who": null
  },
  "ch71_s030_0001": {
   "text": "T2: вторая развилка на ветке сомнения.",
   "who": null
  },
  "ch71_s040_0001": {
   "text": "T2: концовка A.",
   "who": null
  },
  "ch71_s050_0001": {
   "text": "T2: концовка B.",
   "who": null
  },
  "ch71_s060_0001": {
   "text": "T2: концовка C.",
   "who": null
  },
  "ch71_s070_0001": {
   "text": "T2: концовка D.",
   "who": null
  }
 },
 "schema": "ledger@2"
}
