{
 "chapter": "ch90",
 "menus": {},
 "retired": {},
 "says": {
  "ch90_s010_0001": {
   "text": "Море. DLC-эпизод начинается здесь.",
   "who": null
  },
  "ch90_s010_0002": {
   "text": "Догоняй!",
   "who": "mira"
  },
  "ch90_s010_0003": {
   "text": "КОНЕЦ ДЕМО DLC",
   "who": null
  }
 },
 "schema": "ledger@2"
}
