{
 "chapter": "ch72",
 "menus": {
  "ch72_s010_m001": {
   "items": [
    "Ничего не переводить",
    "Перевести 1000",
    "Перевести 5000"
   ]
  }
 },
 "retired": {},
 "says": {
  "ch72_s010_0001": {
   "text": "T3: сколько перевести.",
   "who": null
  },
  "ch72_s020_0001": {
   "text": "T3: проверка порога.",
   "who": null
  },
  "ch72_s030_0001": {
   "text": "T3: секретная сцена за порогом 5000 и левой веткой T1.",
   "who": null
  },
  "ch72_s040_0001": {
   "text": "T3: обычная сцена без порога.",
   "who": null
  },
  "ch72_s050_0001": {
   "text": "T3: конец главы гейтов.",
   "who": null
  }
 },
 "schema": "ledger@2"
}
