{
 "chapter": "ch70",
 "menus": {
  "ch70_s010_m001": {
   "items": [
    "Пойти налево",
    "Пойти направо"
   ]
  },
  "ch70_s040_m001": {
   "items": [
    "Ускориться",
    "Идти медленно"
   ]
  }
 },
 "retired": {},
 "says": {
  "ch70_s010_0001": {
   "text": "T1: развилка первого ромба.",
   "who": null
  },
  "ch70_s020_0001": {
   "text": "T1: левая ветка ромба.",
   "who": null
  },
  "ch70_s030_0001": {
   "text": "T1: правая ветка ромба.",
   "who": null
  },
  "ch70_s040_0001": {
   "text": "T1: ветки сошлись — узел слияния.",
   "who": null
  },
  "ch70_s040_0002": {
   "text": "Пришли слева.",
   "who": null
  },
  "ch70_s050_0001": {
   "text": "T1: конец главы после второго ромба.",
   "who": null
  }
 },
 "schema": "ledger@2"
}
